[
  {
    "id": "thyroid-function",
    "conditionId": "schilddrusenfunktionsstorung",
    "label": "Auffälliges TSH / Verdacht auf Funktionsstörung",
    "contexts": [
      "suspicion",
      "follow-up"
    ],
    "testIds": [
      "thyroid-function-reflex"
    ],
    "indication": "Klinische Konstellation und Vorbefunde vor einem Laborpanel klären. Ein isoliertes Symptom beweist keine Funktionsstörung.",
    "prerequisites": [
      "Akute Erkrankung, Biotin und Schilddrüsenmedikation berücksichtigen.",
      "Ohne zentralen Verdacht TSH zuerst: bei Erhöhung fT4, bei Erniedrigung fT4 und fT3.",
      "Bei Hypophysenverdacht TSH und fT4 gemeinsam; TSH allein reicht nicht."
    ],
    "results": {
      "normal": "Bei fehlendem zentralem Verdacht und plausibler Messung andere Ursachen der Beschwerden erwägen.",
      "abnormal": "TSH und freie Hormone gemeinsam einordnen; manifeste und subklinische Befundmuster unterscheiden.",
      "borderline": "Persistenz und Störfaktoren prüfen, keine Diagnose aus einem Grenzwert; Wiederholung im geeigneten Abstand.",
      "discordant": "Medikation, Zeitpunkt, zentrale Störung und Assayinterferenz mit dem Labor prüfen.",
      "uninterpretable": "Akute Erkrankung oder relevante Interferenz zunächst berücksichtigen; nicht routinemäßig Zusatztests anhängen."
    },
    "urgent": "Schwere klinische Entgleisung ist kein Routinekontrollfall; zeitnahe ärztliche Akutbeurteilung.",
    "burden": "Ungezielte Hormon-/Antikörperpanels können Zufallsbefunde erzeugen.",
    "reflection": "Würde ein weiterer Wert die aktuelle Fragestellung beantworten?",
    "sources": [
      {
        "title": "NICE NG145: Thyroid disease",
        "year": 2023,
        "url": "https://www.nice.org.uk/guidance/ng145/chapter/recommendations",
        "kind": "Leitlinie",
        "note": "Abschnitte 1.2–1.3: Testindikation, TSH-Reflexdiagnostik, zentrale Störung und Interferenzen."
      }
    ],
    "lastReviewed": "2026-09-05",
    "reviewStatus": "needs-review",
    "evidenceQuality": "moderate",
    "dataCompleteness": "partial",
    "sourceCheck": {
      "status": "verified",
      "checkedAt": "2026-09-05",
      "location": "Abschnitte 1.2–1.3: Testindikation, TSH-Reflexdiagnostik, zentrale Störung und Interferenzen.",
      "note": "Kontext und Leitlinienempfehlung abgeglichen; keine quantitative Testgüte daraus abgeleitet. Menschliche Freigabe offen."
    }
  },
  {
    "id": "prolactin",
    "conditionId": "hyperprolaktinamie",
    "label": "Erhöhtes Prolaktin: persistierend oder störbedingt?",
    "contexts": [
      "suspicion",
      "incidental",
      "follow-up"
    ],
    "testIds": [
      "prolactin-context"
    ],
    "indication": "Hyperprolaktinämie ist zunächst ein Befund, nicht automatisch ein Prolaktinom.",
    "prerequisites": [
      "Schwangerschaft, Stress, Medikamente, Schilddrüsen- und Nierenfunktion berücksichtigen.",
      "Bei milder Erhöhung Messung unter geeigneten Bedingungen bestätigen; Makroprolaktin im passenden Kontext prüfen.",
      "Große Raumforderung bei nur mäßigem Wert: Labor auf Verdünnung/Hook-Effekt ansprechen."
    ],
    "results": {
      "normal": "Bei plausibler Messung andere Ursachen für Zyklus-, Sexual- oder Fertilitätsbeschwerden prüfen.",
      "abnormal": "Persistierende, nicht anderweitig erklärte Erhöhung endokrinologisch abklären; Bildgebung indikationsbezogen.",
      "borderline": "Vor einer Bildgebung Stress, Medikamente und Wiederholungsmessung prüfen.",
      "discordant": "Makroprolaktin, Hook-Effekt und Laborinterferenz abhängig von Phänotyp und Bildgebung klären.",
      "uninterpretable": "Eine gestörte Messung nicht mit einer zweiten unabhängigen Erkrankungswahrscheinlichkeit verrechnen."
    },
    "urgent": "Neue Sehstörung oder akuter starker Kopfschmerz bei Hypophysenverdacht erfordert dringliche Abklärung.",
    "burden": "Ungezielte MRT kann zusätzliche Inzidentalome aufdecken; Medikamente nicht eigenständig absetzen.",
    "reflection": "Welche nichttumoröse Erklärung passt zu diesem Befund?",
    "sources": [
      {
        "title": "Pituitary Society: Prolactinoma consensus",
        "year": 2023,
        "url": "https://doi.org/10.1038/s41574-023-00886-5",
        "kind": "Leitlinie",
        "note": "Biochemische Diagnostik: Wiederholung bei <5-facher Normobergrenze, Stress, Makroprolaktin und Hook-Effekt."
      }
    ],
    "lastReviewed": "2026-09-05",
    "reviewStatus": "needs-review",
    "evidenceQuality": "moderate",
    "dataCompleteness": "partial",
    "sourceCheck": {
      "status": "verified",
      "checkedAt": "2026-09-05",
      "location": "Biochemische Diagnostik: Wiederholung bei <5-facher Normobergrenze, Stress, Makroprolaktin und Hook-Effekt.",
      "note": "Kontext und Leitlinienempfehlung abgeglichen; keine quantitative Testgüte daraus abgeleitet. Menschliche Freigabe offen."
    }
  },
  {
    "id": "testosterone",
    "conditionId": "mannlicher-hypogonadismus",
    "label": "Niedriges Testosteron: Mangel oder Kontext?",
    "contexts": [
      "suspicion",
      "follow-up"
    ],
    "testIds": [
      "testosterone-confirmation"
    ],
    "indication": "Abklärung bei passenden Symptomen/Zeichen; kein allgemeines Screening asymptomatischer Männer.",
    "prerequisites": [
      "Zwei morgendliche nüchterne Gesamt-Testosteronmessungen unter stabilen Bedingungen.",
      "SHBG und freie Fraktion bei begründeter Indikation; validierte Methoden und Referenzen.",
      "Akute Erkrankung, Adipositas, Medikamente und Kinderwunsch erfassen."
    ],
    "results": {
      "normal": "Bei plausiblen Werten alternative Ursachen der Beschwerden betrachten.",
      "abnormal": "Symptome plus konsistent niedrige Werte: Ursache mit LH/FSH und gegebenenfalls weiterer Diagnostik einordnen.",
      "borderline": "Befund wiederholen; SHBG-Kontext und bei Indikation freie Fraktion berücksichtigen.",
      "discordant": "Symptome, SHBG, Assay und reversible Einflüsse zusammenführen.",
      "uninterpretable": "Während akuter Erkrankung oder ungeeigneter Abnahme keine definitive Einordnung."
    },
    "urgent": "Raumforderungssymptome oder zusätzliche Hypophysenausfälle benötigen gesonderte Abklärung.",
    "burden": "Ein niedriger Einzelwert ist keine automatische Indikation zur Substitution.",
    "reflection": "Ist eine reversible Ursache plausibler als ein dauerhafter Hormonmangel?",
    "sources": [
      {
        "title": "Endocrine Society: Testosterone therapy in men with hypogonadism",
        "year": 2018,
        "url": "https://doi.org/10.1210/jc.2018-00229",
        "kind": "Leitlinie",
        "note": "Empfehlungen 1.1–1.4: Symptome, wiederholte morgendliche nüchterne Messung, freie Fraktion und Ursachenklärung."
      }
    ],
    "lastReviewed": "2026-09-05",
    "reviewStatus": "needs-review",
    "evidenceQuality": "moderate",
    "dataCompleteness": "partial",
    "sourceCheck": {
      "status": "verified",
      "checkedAt": "2026-09-05",
      "location": "Empfehlungen 1.1–1.4: Symptome, wiederholte morgendliche nüchterne Messung, freie Fraktion und Ursachenklärung.",
      "note": "Kontext und Leitlinienempfehlung abgeglichen; keine quantitative Testgüte daraus abgeleitet. Menschliche Freigabe offen."
    }
  },
  {
    "id": "bone-risk",
    "conditionId": "osteoporose-frakturrisiko",
    "label": "Osteoporose: Frakturrisiko statt Einzelwert",
    "contexts": [
      "screening",
      "suspicion",
      "follow-up"
    ],
    "testIds": [
      "dxa-fracture-context"
    ],
    "indication": "Frakturanamnese, Risikofaktoren und mögliche Konsequenzen entscheiden über die Basisdiagnostik.",
    "prerequisites": [
      "Alter, vorausgegangene Fragilitätsfraktur, Stürze, Glukokortikoide und sekundäre Ursachen erfassen.",
      "DXA im geeigneten Kontext; bei jungen Erwachsenen Z-Score-Kontext beachten.",
      "DVO: 3-Jahres-Risiko für Hüft-/Wirbelkörperfrakturen; FRAX: 10-Jahres-Risiken, nicht austauschbar."
    ],
    "results": {
      "normal": "Unauffällige Knochendichte beseitigt nicht jedes Frakturrisiko; Anamnese und Sturzrisiko bleiben relevant.",
      "abnormal": "Knochendichte, Frakturen und Gesamtrisiko gemeinsam bewerten; keine LR-Diagnose aus einem T-Score.",
      "borderline": "Zusätzliche Risikofaktoren und diagnostische Konsequenz vor weiteren Messungen klären.",
      "discordant": "Fraktur bei wenig auffälliger DXA: Messqualität, Lokalisation und sekundäre Ursachen prüfen.",
      "uninterpretable": "Artefakte oder ungeeignete Messregionen fachlich bewerten lassen."
    },
    "urgent": "Akuter Frakturverdacht wird unabhängig vom langfristigen Risikoscore abgeklärt.",
    "burden": "Kontrollabstände müssen eine interpretierbare Veränderung erwarten lassen.",
    "reflection": "Welcher Endpunkt und welcher Zeitraum sind für diese Person wichtig?",
    "sources": [
      {
        "title": "DVO-Leitlinie Osteoporose",
        "year": 2023,
        "url": "https://leitlinien.dv-osteologie.org/",
        "kind": "Leitlinie",
        "note": "Kapitel Basisdiagnostik und Risikobeurteilung. Gültigkeit bis 30.09.2026; vor späterer Nutzung Nachfolgefassung prüfen."
      }
    ],
    "lastReviewed": "2026-09-05",
    "reviewStatus": "needs-review",
    "evidenceQuality": "moderate",
    "dataCompleteness": "partial",
    "sourceCheck": {
      "status": "verified",
      "checkedAt": "2026-09-05",
      "location": "Kapitel Basisdiagnostik und Risikobeurteilung. Gültigkeit bis 30.09.2026; vor späterer Nutzung Nachfolgefassung prüfen.",
      "note": "Kontext und Leitlinienempfehlung abgeglichen; keine quantitative Testgüte daraus abgeleitet. Menschliche Freigabe offen."
    }
  },
  {
    "id": "androgen-cycles",
    "conditionId": "hyperandrogenismus-zyklusstorung",
    "label": "Hyperandrogenismus / Zyklusstörung",
    "contexts": [
      "suspicion",
      "follow-up"
    ],
    "testIds": [
      "androgen-cycle-context"
    ],